Key,Page,English,Thai,Armenian,Russian,Arabic,Farsi,Georgian
planAndBilling.yourPlan.plan.downgrade.label,planAndBilling,Your plan will be downgraded to {nextPlan},แผนของคุณจะถูกดาวน์เกรดเป็น {nextPlan},Դուք անցում կկատարեք ավելի ցածր փաթեթի {nextPlan},,,,
planBillingNotification.downgrade.label,planAndBilling,Your plan will be downgraded on the next payment due.  You can continue using the current plan until {date} at {time},แผนของคุณจะถูกดาวน์เกรดในรอบบิลถัดไป  คุณสามารถใช้แผนปัจจุบันได้จนถึงวันที่ {date} เวลา {time},Դուք անցում կկատարեք ավելի ցածր փաթեթի հաջորդ վճարման ժամանակ։ Դուք կարող եք շարունակել օգտագործել ընթացիկ փաթեթը մինչև {date}  {time}-ը։,,,,
planAndBilling.billingDetails.form.zipCode.validation,planAndBilling,You have to type valid zip code,คุณต้องกรอกรหัสไปรษณีย์ที่ถูกต้อง,Դուք պետք է ներմուծեք վավեր zip կոդ,,,,
planAndBilling.billingHistory.paymentStatus.declined,planAndBilling,Payment Declined,การชำระเงินถูกปฏิเสธ,Վճարումը Մերժվել է,,,,
planAndBilling.yourPlan.changePlan.plan.feature.initialInviteEmail,planAndBilling,Initial Invite (Email),การส่งคำเชิญครั้งแรก (อีเมล์),Սկզբնական Հրավեր (Էլ․ Փոստ),,,,
planAndBilling.yourPlan.plan.expired,planAndBilling,Expired,หมดอายุ,Վերջացել է,,,,
planAndBilling.yourPlan.changePlanSuccess.startYourPlanNow,planAndBilling,Start your plan now!,เริ่มใช้แผนใหม่ของคุณได้เลย,Օգտվեք Փաթեթից հիմա՛,,,,
planAndBilling.paymentMethod.card.defaultCard,planAndBilling,Default,ใช้บัตรนี้เป็นบัตรหลัก,Հիմնական քարտ,,,,
planAndBilling.paymentMethod.card.setAsDefaultCard,planAndBilling,Set as Default,ตั้งค่าบัตรนี้เป็นบัตรหลัก,Նշել որպես Հիմնական քարտ,,,,
planBillingNotification.gracePeriod.label,planAndBilling,Your account will expire on {date} due to payment failure. Please <l1>change your payment method.</l1>,บัญชีของคุณจะหมดอายุในวันที่ {date} เนื่องจากการชำระเงินไม่สำเร็จ โปรด <l1>เปลี่ยนวิธีการชำระเงิน.</l1>,Ձեր հաշիվը կփակվի {date} վճարման ձախողման պատճառով։ Խնդրում ենք <l1>փոխեք վճարման եղանակը։</l1>,,,,
planBillingNotification.restrict.label,planAndBilling,Your account has expired due to multiple payment failures. Please <l1>change your payment method</l1> or contact us at support@ifyoucan.com,บัญชีของคุณหมดอายุ เนื่องจากมีการชำระเงินไม่สำเร็จหลายครั้ง.  โปรด <l1>เปลี่ยนวิธีการชำระเงินของคุณ </l1> หรือติดต่อเราที่  support@ifyoucan.com,Ձեր հաշիվը փակվել է վճարման մի քանի ձախողումների պատճառով։ Խնդրում ենք <l1>փոխեք վճարման եղանակը</l1> կամ կապնվեք մեզ հետ support@ifyoucan.com,,,,
planBillingNotification.cancel.label,planAndBilling,Your plan will be canceled on the next payment due. You can continue using the current plan until {date} at {time},แผนของคุณจะถูกยกเลิกในรอบบิลถัดไป.คุณสามารถใช้แผนปัจจุบัน จนถึงวันที่ {date} เวลา {time},Ձեր փաթեթը կչեղարկվի հաջորդ վճարման ժամանակ։ Դուք կարող եք շարունակել օգտագործել ընթացիկ փաթեթը  {date} {time}-ին,,,,
createNotification.dialog.overdraft.dialog.overdraft.limit.title,planAndBilling,Overdraft Notice,แจ้งเตือนยอดการใช้งานเกิน,Օվերդրաֆտի Նախազգուշացում,,,,
createNotification.dialog.overdraft.dialog.overdraft.limit.body,planAndBilling,"We’re sorry! Due to our overdraft policy. You can send overdraft messages up to {limitPercent}% of your <b>{planName}</b> or <b>{planNotesAvailable, number}</b> notifications. You will not be able to send more messages unless you upgrade your account or wait for your renewal period.","ขออภัย เนื่องจากนโยบายการใช้งานเกินจำนวน คุณสามารถส่งการแจ้งเตือนเกินจำนวนสูงสุดไม่เกิน {limitPercent}% ของแผน <b>{planName}</b> หรือ <b>{planNotesAvailable, number}</b> การแจ้งเตือน คุณไม่สามารถส่งการแจ้งเตือนเกินจำนวนนี้ นอกจากคุณจะอัพเกรด หรือ รอรอบการต่ออายุแผนของคุณในรอบถัดไป ","Ցավում ենք։ Օվերդրաֆտի Քաղաքականությունը հիմք ընդունելով՝ Դուք կարող եք ուղարկել օվերդրաֆտ ծանուցումներ Ձեր  ընթացիկ փաթեթի <b>{planName}</b>  կամ  <b>{planNotesAvailable, number}</b> ծանուցումների {limitPercent}%-ի չափով։ Դուք հնարավորություն չեք ունենա ավելին ուղարկելու, եթե անցում չկատարեք ավելի բարձր փաթեթի կամ սպասեք մինչ փաթեթի թարմացման հաջորդ ժամանակահատվածը։ ",,,,
planAndBilling.yourPlan.changePlan.changePaymentMethod.label,planAndBilling,Change Your Payment Method,เปลี่ยนวิธีการชำระเงินของคุณ,Փոխել Վճարման Եղանակը,,تغيير طريقة الدفع الخاصة بك,,
planAndBilling.yourPlan.changePlan.plan.upgrade,planAndBilling,Your Plan upgraded from  {currentPlan} to {nextPlan},แผนของคุณถูกอัพเกรด จาก {currentPlan} เป็น {nextPlan},Ձեր փաթեթը փոփոխվել է  {currentPlan} ից {nextPlan} ի,,تمت ترقية الباقة من { الباقة الحالية} إلى  {الباقة القادمة},,
planAndBilling.yourPlan.plan.canceled.label,planAndBilling,Canceled,ยกเลิก,Չեղարկված,,ألغيت,,
planAndBilling.yourPlan.changePlan.plan.downgrade,planAndBilling,Your Plan downgraded from  {currentPlan} to {nextPlan},แผนของคุณถูกอัพเกรด จาก  {currentPlan} เป็น {nextPlan},Ձեր փաթեթը փոփոխվել է  {currentPlan} ից {nextPlan} ի,,تمت تخفيض الباقة من { الباقة الحالية} إلى  {الباقة القادمة},,
planAndBilling.yourPlan.plan.freeTrial.ended,planAndBilling,"Free Trial has been ended, Please select new plan",การทดลองใช้ฟรีสิ้นสุดลงแล้ว โปรดเลือกแผนใหม่,Անվճար Փորձարկումն ավարտվել է։ Խնդրում ենք ընտրել նոր փաթեթ։,,تم إنهاء التجربة المجانية ، يرجى تحديد باقة جديدة,,
planAndBilling.yourPlan.changePlan.plan.term.label,planAndBilling,Subscription Term,เงื่อนไขการสมัครสมาชิก,Բաժանորդագրության ժամկետ,,مدة الاشتراك,,
planAndBilling.yourPlan.changePlan.plan.term.typeSubscription,planAndBilling,"{type, select, monthly {Monthly} annual {Annual}} Subscription","{type, select, monthly {รายเดือน} annual {รายปี}} การสมัครสมาชิก","{type, select, monthly {Monthly} annual {Annual}} Բաժանորդագրություն",,"{type, select, monthly {شهري} annual {سنوي}} أشتراك",,
planAndBilling.yourPlan.changePlan.plan.feature,planAndBilling,Features Available with Your Plan,ฟีเจอร์ที่ใช้ได้ในแผนของคุณ,Ձեր Փաթեթով տրամադրվող Հնարավորությունները,,الميزات المتوفرة مع باقتك,,
planAndBilling.yourPlan.changePlan.plan.feature.overdraft,planAndBilling,Overdraft,เบิกเกินบัญชี,Օվերդրաֆտ,,سحب زائد,,
planAndBilling.yourPlan.changePlan.plan.feature.notificationTimeline,planAndBilling,Notification Timeline,ระยะเวลาการแจ้งเตือน,Ծանուցումների Տարեգիր,,الجدول الزمني للإخطار,,
planAndBilling.yourPlan.changePlan.plan.feature.multimediaSupport,planAndBilling,Multimedia Support,รองรับมัลติมีเดีย,Մուլտիմեդիայի Հնարավորություն,,دعم الوسائط المتعددة,,
planAndBilling.yourPlan.changePlan.plan.feature.profileInfo,planAndBilling,Profile Info,ข้อมูลโปรไฟล์,Հաշվի հիմնական տեղեկություն,,معلومات الشخصي,,
planAndBilling.yourPlan.changePlan.plan.feature.analytics,planAndBilling,Analytics,การวิเคราะห์,Վերլուծություն,,تحليلات,,
planAndBilling.yourPlan.changePlan.plan.feature.subscribers,planAndBilling,Subscribers,สมาชิก,Բաժանորդներ,,مشتركين,,
planAndBilling.yourPlan.changePlan.plan.feature.groups,planAndBilling,Groups,กลุ่ม,Խմբեր,,مجموعات,,
planAndBilling.yourPlan.changePlan.plan.feature.plansBilling,planAndBilling,Plans & Billing,แผน & การเรียกเก็บเงิน,Փաթեթներ և Վճարումներ,,الباقات والفواتير,,
planAndBilling.yourPlan.changePlan.plan.feature.initialNotification,planAndBilling,Initial Notification,การแจ้งเตือนครั้งแรก,Սկզբնական Ծանուցում,,الإخطار الأولي,,
planAndBilling.yourPlan.changePlan.plan.feature.teamMembers,planAndBilling,Team Members,สมาชิกทีม,Թիմի Անդամներ,,أعضاء الفريق,,
planAndBilling.yourPlan.changePlan.plan.feature.rolesPermissions,planAndBilling,Roles & Permissions,บทบาทและสิทธิ์การเข้าถึง,Պաշտոններ և Թույլտվություններ,,الأدوار والأذونات,,
planAndBilling.yourPlan.changePlan.plan.feature.initialInvite,planAndBilling,Initial Invite,การเชิญครั้งแรก,Սկզբնական Ծանուցում,,دعوة الأولي,,
planAndBilling.yourPlan.paymentSummary.nextDue,planAndBilling,Next payment due on {date},กำหนดชำระครั้งต่อไปในวันที่ {date},Հաջորդ վճարման ժամկետն է {date},,الدفعة التالية المستحقة في {تاريخ},,
planAndBilling.yourPlan.paymentSummary.notRequired,planAndBilling,No payment method required,ไม่ต้องกรอกวิธีการชำระเงิน,Վճարման եղանակ չի պահանջվում,,لا طريقة الدفع المطلوبة,,
planAndBilling.paymentMethod.dialog.subTitle,planAndBilling,Please select your preferred payment method,โปรดเลือกวิธีการชำระเงินที่คุณต้องการ,Ընտրեք Ձեզ համար նախընտրելի վճարման եղանակը,,يرجى اختيار طريقة الدفع المفضلة لديك,,
planAndBilling.paymentMethod.card.creditCard,planAndBilling,Credit Card,บัตรเครดิต,Բանկային քարտ,,بطاقة الائتمان,,
planAndBilling.paymentMethod.card.paypal,planAndBilling,Paypal,Paypal,Paypal,,Paypal,,
planAndBilling.paymentMethod.deleteConfirm.body,planAndBilling,Removing it means you won’t be able to use this payment method for NotifyMe without adding it again,การลบนี้หมายความว่าคุณจะไม่สามารถใช้วิธีการชำระเงินนี้สำหรับ NotifyMe และไม่สามารถเพิ่มวิธีการชำระเงินนี้ได้อีก,"Ջնջելու դեպքում Դուք չեք կարողանա օգտագործել վճարման այս եղանակը NotifyMe-ի համար, մինչև չավելացնեք այն կրկին",,إزالته تعني أنك لن تتمكن من استخدام طريقة الدفع هذه لـ NotifyMe دون إضافتها مرة أخرى,,
planAndBilling.paymentMethod.deleteConfirm.title,planAndBilling,Remove this payment method?,ลบวิธีการชำระเงินนี้ไหม,Ջնջել այս վճարման եղանակը՞,,إزالة طريقة الدفع هذه؟,,
planAndBilling.paymentMethod.add.isDefault,planAndBilling,Set as default,ตั้งเป็นค่าเริ่มต้น,Ընտրել որպես հիմնական,,تعيين كافتراضي,,
planAndBilling.paymentMethod.addPaymentMethod,planAndBilling,Choose a different payment method,เลือกวิธีการชำระเงินอื่น,Ընտրել այլ վճարման եղանակ,,اختر طريقة دفع مختلفة,,
planAndBilling.billingDetails.form.state.empty.label,planAndBilling,Please select country,กรุณาเลือกประเทศ,Ընտրեք երկիրը,,يرجى اختيار البلد,,
planAndBilling.billingDetails.form.title.label,planAndBilling,Change Your Billing Details,เปลี่ยนรายละเอียดการเรียกเก็บเงินของคุณ,Փոխել Վճարման Մանրամասները,,تغيير تفاصيل الفواتير الخاصة بك,,
planAndBilling.billingDetails.form.subTitle.label,planAndBilling,Please add billing details,โปรดเพิ่มรายละเอียดการเรียกเก็บเงิน,Ավելացնել վճարման մանրամասները,,يرجى إضافة تفاصيل الفواتير,,
planAndBilling.billingHistory.paypal,planAndBilling,Paypal,Paypal,Paypal,,Paypal,,
planAndBilling.billingHistory.paymentStatus.reject,planAndBilling,Payment Reject,ปฏิเสธการชำระเงิน,Չեղարկել վճարումը,,رفض الدفع,,
planAndBilling.usageHistory.table.description.downgradeTo,planAndBilling,Downgrade to {name},ดาวน์เกรดเป็น {name},Նվազեցնել դեպի {name},,التخفيض إلى {اسم},,
planAndBilling.usageHistory.table.description.upgradeTo,planAndBilling,Upgrade to {name},อัพเกรดเป็น {name},Բարձրացնել դեպի {name},,الترقية إلى {اسم},,
action.remove,planAndBilling,Remove,ลบ,Ջնջել,,إزالة ,,
action.goBack,planAndBilling,Go Back,กลับ,Վերադառնալ,,عد,,
action.renew,planAndBilling,Renew,ต่ออายุ,Թարմացնել,,التجديد,,
action.upgrade,planAndBilling,Upgrade,อัพเกรด,Բարձրացնել փաթեթը,,الترقية ,,
planAndBilling.yourPlan.label,planAndBilling,Your Plan,แผนของคุณ,Ձեր փաթեթը,,باقتك,,
planAndBilling.yourPlan.plan.info.label,planAndBilling,"{numberNotifications, number} notifications / {type, select, monthly {month} annual {year}} at ${priceRatio} each","{numberNotifications, number} การแจ้งเตือน / {type, select, monthly {รายเดือน} annual {รายปี}} เฉลี่ยราคา ${priceRatio} ต่อการแจ้งเตือน","{numberNotifications, number} ծանուցումներ / {type, select, monthly {ամիս} annual {տարի}} at ${priceRatio} յուրաքանչյուրը",,"{numberNotifications, number} اشعارات/ {type, select, monthly {شهر} annual {سنة}} في ${priceRatio} كل",,
planAndBilling.yourPlan.plan.nextDue.label,,Next due on {date},รอบบิลถัดไปคือ {date},Հաջորդ վճարման օրը {date},,التالي مستحق في {date},,
planAndBilling.yourPlan.plan.freeTrial.label,planAndBilling,"{trialPeriodCount, number} Day Free Trial","{trialPeriodCount, number} วัน ทดลองฟรี","{trialPeriodCount, number} Օր Անվճար Փորձարկում",,"{trialPeriodCount, number} يوم التجربة المجانية ",,
planAndBilling.yourPlan.plan.freeTrial.info.label,planAndBilling,"{notesQuantity, plural, one {# notification} other {# notifications}} for {trialPeriodCount, plural, one {# day} other {# days}} at $0.00 each","{notesQuantity, plural, one {# การแจ้งเตือน} other {#การแจ้งเตือน}} สำหรับ {trialPeriodCount, plural, one {# วัน} other {# วัน}} เฉลี่ยราคา $0.00 ต่อการแจ้งเตือน","{notesQuantity, plural, one {# ծանուցում} other {# ծանուցումներ}} {trialPeriodCount, plural, one {# օր} other {# օր}} $0.00 յուրաքանչյուրը",,"{notesQuantity, plural, one {# اشعار} other {# اشعارات}} بسبب {trialPeriodCount, plural, one {# يوم} other {# أيام}} في 0.00 دولار لكل منهما",,
planAndBilling.yourPlan.plan.info.price.label,planAndBilling,"{type, select, monthly {Monthly} annual {Annual}} payment of ${price, number}","{type, select, monthly {รายเดือน} annual {รายปี}} การชำระเงินของ ${price, number}","{type, select, monthly {Ամսական} annual {Տարեկան}} ${price, number} վճարում",,"{type, select, monthly {شهري} annual {سنوي}} دفع ${price, number}",,
planAndBilling.yourPlan.plan.info.expiresOn.label,planAndBilling,"Expires on {date} ({remainDays, plural, one {# day} other {# days}} from now)","หมดอายุในวันที่ {date} ({remainDays, plural, one {# วัน} other {# วัน}} ต่อจากนี้)","Սպառվում է այսօրվանից սկսած {date} ({remainDays, plural, one {# օր} other {# օր}} հետո  )",,"تنتهي صلاحيته في {date} ({remainDays, plural, one {# يوم} other {# أيام}} من الان )",,
planAndBilling.yourPlan.plan.info.nextDue.label,planAndBilling,Next due on {date},รอบบิลถัดไปคือ {date},Հաջորդ վճարման օրը {date},,التالي مستحق في {date},,
planAndBilling.yourPlan.notificationsEarned.label,planAndBilling,Notifications Earned,จำนวนที่สามารถส่งการแจ้งเตือน,Չօգտագործված Ծանուցումներ,,الإخطارات المكتسبة,,
planAndBilling.yourPlan.notificationsSent.label,planAndBilling,Notifications Sent,ส่งการแจ้งเตือนแล้ว,Ուղարկված Ծանուցումներ,,تم إرسال الإشعارات,,
planAndBilling.yourPlan.notificationsBalance.label,planAndBilling,Notifications Balance,จำนวนคงเหลือที่สามารถส่งการแจ้งเตือน,Ծանուցումների մնացորդ,,ميزان الإخطارات,,
planAndBilling.yourPlan.changePlan.changeToFreeTier,planAndBilling,CHANGE TO FREE TIER,เปลี่ยนเป็นการใช้งานฟรี,Անցնել Անվճար TIER-ի,,التغيير إلى الإطارات المجانية,,
planAndBilling.yourPlan.changePlan.changeToFreeTier.subTitle,planAndBilling,"{quantity, number} notifications / mo | No Teams, Groups or Multimedia","{quantity, number} การแจ้งเตือน / เดือน| ไม่สามารถเข้าถึงทีม, กลุ่ม หรือ มัลติมีเดีย","{quantity, number} ծանուցումներ / ամս․ | Առանց Թիմ, Խմբեր և Մուլտիմեդիա",,"{quantity, number} اشعارات / شهر | لا فرق ، مجموعات",,
planAndBilling.yourPlan.changePlan.payment.notRequired,,No payment method required,ไม่ต้องกรอกวิธีการชำระเงิน,Չի պահանջում վճարման եղանակ,,لا طريقة الدفع المطلوبة,,
planAndBilling.yourPlan.changePlan.notAllowToDowngrade,planAndBilling,"Currently, we do not allow plan downgrades",ขณะนี้เราไม่อนุญาตให้มีการดาวน์เกรดแผน,"Ներկայումս, մենք թույլ չենք տալիս անցումը ավելի ցածր փաթեթի",,حاليًا ، لا نسمح بتخفيضات الخطة,,
planAndBilling.yourPlan.changePlan.label,planAndBilling,Choose Your New Plan,เลือกแผนใหม่ที่คุณต้องการ,Ընտրեք Ձեր Նոր Փաթեթը,,اختر خطتك الجديدة,,
planAndBilling.yourPlan.changePlan.subTitle,planAndBilling,Choose the plan that makes sense for your business and your anticipated notification volume,เลือกแผนและปริมาณการแจ้งเตือนที่เหมาะสมสำหรับธุรกิจของคุณ,Խնդրում ենք ուշադիր լինեն նոր փաթեթն ընտրելիս,,اختر الخطة التي تناسب أعمالك وحجم الإشعارات المتوقع,,
planAndBilling.yourPlan.changePlan.plan.label,planAndBilling,Choose your new Plan,เลือกแผนใหม่ที่คุณต้องการ,Ընտրեք Ձեր նոր փաթեթը,,اختر خطتك الجديدة,,
planAndBilling.yourPlan.changePlan.plan.section.description,planAndBilling,"Includes Teams, Groups and Multimedia functionality",รวมถึงทีม กลุ่มและฟังก์ชั่นมัลติมีเดีย,"Ներառում է Թիմեր, Խմբեր և Մուլտիմեդիա ",,يشمل فرق ، وظائف المجموعات والوسائط المتعددة,,
planAndBilling.yourPlan.changePlan.billingDetails.label,planAndBilling,Please add billing details,โปรดเพิ่มรายละเอียดการเรียกเก็บเงิน,Ավելացրեք վճարման մանրամասները,,يرجى إضافة تفاصيل الفواتير,,
planAndBilling.yourPlan.changePlan.paymentMethod.label,planAndBilling,Please select a payment method,โปรดเลือกวิธีการชำระเงิน,Ավելացրեք վճարման եղանակը,,الرجاء اختيار طريقة الدفع,,
planAndBilling.yourPlan.changePlan.termAndService.label,planAndBilling,"By completing the transaction, you agree to these <b1>Terms of Service.</b1>",คุณยอมรับ<b1>ข้อกำหนดในการให้บริการ </b1>โดยการทำธุรกรรมนี้ให้เสร็จสิ้น,"Գործարքն ավարտին հասցնելով, Դուք համաձայնում եք  <b1>Ծառայությունների մատուցման պայմաններին.</b1> ",,من خلال إتمام المعاملة ، فإنك توافق على <b1> شروط الخدمة هذه. </ b1>,,
planAndBilling.yourPlan.changePlan.totalBilled.label,planAndBilling,Total billed:,การเรียกเก็บเงินทั้งหมด:,Ընդհանուր գանձվում է։,,إجمالي الفاتورة:,,
planAndBilling.yourPlan.changePlan.recurring.label,planAndBilling,"Recurring monthly payment of ${price, number}","ชำระรายเดือนเป็นจำนวน ${price, number}","Ամսական կրկնվող վճարում ${price, number}",,الدفعة الشهرية المتكررة $ {price، number},,
planAndBilling.yourPlan.changePlan.pleaseSelectPlan.label,planAndBilling,Please select your new plan,โปรดเลือกแผนใหม่ที่คุณต้องการ,Ընտրեք Ձեր նոր փաթեթը,,يرجى اختيار باقتك الجديدة,,
planAndBilling.yourPlan.changePlan.plan.info.label,planAndBilling,"{numberNotifications, number} notifications / {type, select, monthly {month} annual {year}} at ${priceRatio, number} each","{numberNotifications, number} การแจ้งเตือน / {type, select, monthly {รายเดือน} annual {รายปี}} เฉลี่ยราคา ${priceRatio, number} ต่อการแจ้งเตือน","{numberNotifications, number} ծանուցումներ / {type, select, monthly {ամիս} annual {տարի}} ${priceRatio, number} յուրաքանչյուրը",,"{numberNotifications, number} أشعارات/ {type, select, monthly {شهر} annual {سنة}} مع${priceRatio, number} كل",,
planAndBilling.yourPlan.paymentSummary.dialog.title,planAndBilling,Payment Summary,สรุปการชำระเงิน,Վճարման Ամփոփագիր,,ملخص الدفع,,
