Key,Page,English,Thai,Armenian,Russian,Arabic,Farsi,Georgian
privacyPolicy.content22.3,privacyPolicy,"Provide, improve and develop Services.",ให้บริการปรับปรุงและพัฒนาบริการ,,,,,
privacyPolicy.content22.4,privacyPolicy,We are able to deliver our Services and make suggestions for you by using this information to understand how you use and interact with our Services.,เราสามารถให้บริการของเราและให้คำแนะนำสำหรับคุณโดยใช้ข้อมูลนี้เพื่อทำความเข้าใจว่าคุณใช้และโต้ตอบกับบริการของเราอย่างไร,,,,,
privacyPolicy.content22.5,privacyPolicy,Communicate with you.,สื่อสารกับคุณ,,,,,
privacyPolicy.content22.6,privacyPolicy,"We use your information to send you promotional communications, communicate with you about our Services and let you know about our policies and terms. We also use your information to respond to you when you contact us. You can Opt-out from receiving the marketing emails at any time.",เราใช้ข้อมูลของคุณเพื่อส่งการสื่อสารส่งเสริมการขายสื่อสารกับคุณเกี่ยวกับบริการของเราและแจ้งให้คุณทราบเกี่ยวกับนโยบายและข้อกำหนดของเรา นอกจากนี้เรายังใช้ข้อมูลของคุณเพื่อตอบสนองคุณเมื่อคุณติดต่อเรา คุณสามารถยกเลิกการรับอีเมล์การตลาดได้ตลอดเวลา,,,,,
privacyPolicy.content22.7,privacyPolicy,Promote safety and security.,ส่งเสริมความปลอดภัยและความมั่นคง,,,,,
privacyPolicy.content22.8,privacyPolicy,"We use the information we have to help verify accounts and activity, and to promote safety and security on and off of our Services, such as by investigating suspicious activity or violations of our terms or policies. We work hard to protect your account using teams of engineers, automated systems, and advanced technology such as encryption.",เราใช้ข้อมูลที่เรามีเพื่อช่วยยืนยันบัญชีและกิจกรรมและเพื่อส่งเสริมความปลอดภัย และความปลอดภัยในและนอกบริการของเรา เช่น โดยการตรวจสอบกิจกรรมที่น่าสงสัยหรือการละเมิดข้อกำหนดหรือนโยบายของเรา เราทำงานอย่างหนักเพื่อปกป้องบัญชีของคุณโดยใช้ทีมวิศวกรระบบอัตโนมัติ และเทคโนโลยีขั้นสูงเช่นการเข้ารหัส,,,,,
privacyPolicy.title.content23,privacyPolicy,How we won't use this information!,เราจะไม่ใช้ข้อมูลนี้อย่างไรบ้าง!,,,,,
privacyPolicy.content23.2,privacyPolicy,We will not sell or market the email addresses or other collected personal information of registered Users to third parties.,เราจะไม่ขายหรือทำการตลาดที่อยู่อีเมล์หรือข้อมูลส่วนบุคคลอื่นๆ ที่เก็บรวบรวมของผู้ใช้ที่ลงทะเบียนไปยังบุคคลที่สาม,,,,,
privacyPolicy.title.content24,privacyPolicy,New owner,เจ้าของคนใหม่,,,,,
privacyPolicy.content24.2,privacyPolicy,"If the ownership or control of all or part of our Services or their assets changes, we may transfer your information to the new owner.",หากความเป็นเจ้าของหรือการควบคุมของบริการของเราทั้งหมดหรือบางส่วนหรือการเปลี่ยนแปลงสินทรัพย์ของพวกเขาเราอาจถ่ายโอนข้อมูลของคุณไปยังเจ้าของใหม่,,,,,
privacyPolicy.title.content25,privacyPolicy,How can I delete my device data or my account?,ฉันจะลบข้อมูลอุปกรณ์ หรือบัญชีของฉันได้อย่างไร?,,,,,
privacyPolicy.content25.2,privacyPolicy,"If you want to delete your account you are free to make request to IYC to remove the data. That is done when you select the \""Delete Account\"" button and confirm consequent pop-up. Additional identification may not be required since in accordance with the requirements of EULA your devices and accounts are controlled by you.","หากคุณต้องการลบบัญชีของคุณคุณมีอิสระที่จะขอ IYC เพื่อลบข้อมูล การลบจะเสร็จสิ้นเมื่อคุณเลือกปุ่ม \""ลบบัญชี\"" และยืนยันป๊อปอัปที่ตามมา อาจไม่จำเป็นต้องใช้การระบุตัวบุคคลเพิ่มเติม เนื่องจากเป็นไปตามข้อกำหนดของ EULA อุปกรณ์และบัญชีของคุณถูกควบคุมโดยคุณ",,,,,
privacyPolicy.title.content26,privacyPolicy,How do we respond to legal requests or prevent harm?,เราจะตอบสนองต่อการร้องขอทางกฎหมายหรือป้องกันอันตรายได้อย่างไร?,,,,,
privacyPolicy.content26.2,privacyPolicy,"We may access, preserve and share your information in response to a legal request (like a search warrant, court order or subpoena) if we have a good faith belief that the law requires us to do so. This may include responding to legal requests from jurisdictions outside of the United States where we have a good faith belief that the response is required by law in that jurisdiction, affects users in that jurisdiction, and is consistent with internationally recognized standards. We may also access, preserve and share information when we have a good faith belief it is necessary to: detect, prevent and address fraud and other illegal activity; to protect ourselves, you and others, including as part of investigations; or to prevent death or imminent bodily harm.",เราอาจเข้าถึงรักษาและแบ่งปันข้อมูลของคุณเพื่อตอบสนองต่อคำขอทางกฎหมาย (เช่นหมายศาลค้นหา คำสั่งศาลหรือหมายศาล) หากเรามีความเชื่อโดยสุจริตว่ากฎหมายกำหนดให้เราทำเช่นนั้น ซึ่งอาจรวมถึงการตอบสนองต่อการร้องขอทางกฎหมายจากเขตอำนาจศาลนอกสหรัฐอเมริกา ซึ่งเราเชื่อโดยสุจริตว่าการตอบสนองนั้นถูกต้องตามกฎหมายในเขตอำนาจศาลนั้น ส่งผลกระทบต่อผู้ใช้ในเขตอำนาจศาลนั้นและสอดคล้องกับมาตรฐานที่ยอมรับในระดับสากล เราอาจเข้าถึงรักษาและแบ่งปันข้อมูลเมื่อ เราเชื่อโดยสุจริตว่ามีความจำเป็นต้อง: ตรวจจับ ป้องกันและจัดการ กับการฉ้อโกงและกิจกรรมที่ผิดกฎหมายอื่นๆ เพื่อปกป้องตัวเราเอง คุณ และผู้อื่นรวมถึงเป็นส่วนหนึ่งของการสืบสวน หรือเพื่อป้องกันการเสียชีวิตหรือเป็นอันตรายต่อร่างกาย,,,,,
privacyPolicy.title.content27,privacyPolicy,1. Information IYC collects,1. เก็บรวบรวมข้อมูล IYC ,,,,,
privacyPolicy.content27.2,privacyPolicy,Things You Do and Information You Provide,สิ่งที่คุณทำและข้อมูลที่คุณให้,,,,,
privacyPolicy.content27.3,privacyPolicy,"We collect information details, including Personal Data, when you use our Services/Products, including when you sign up for an account, install one of our apps, buy and attach subscriptions and create issues such as defects, enhancements or questions. This can include information in or about the content you provide. We also collect information about how you use our Services, such as the type of content you keep or delete or the frequency of your activities.",เรารวบรวมรายละเอียดข้อมูลรวมถึงข้อมูลส่วนบุคคลเมื่อคุณใช้บริการ / ผลิตภัณฑ์ของเรา รวมถึงเมื่อคุณลงทะเบียนบัญชีติดตั้งหนึ่งในแอปพลิเคชั่นของเรา ซื้อและแนบการสมัครสมาชิก และสร้างปัญหา เช่น ข้อบกพร่อง การปรับปรุง หรือ คำถาม ซึ่งอาจรวมถึงข้อมูลในหรือเกี่ยวกับเนื้อหาที่คุณให้ นอกจากนี้เรายังรวบรวมข้อมูลเกี่ยวกับวิธีการใช้บริการของเรา เช่น ประเภทของเนื้อหาที่คุณเก็บ หรือลบหรือความถี่ของกิจกรรมของคุณ,,,,,
privacyPolicy.content27.4,privacyPolicy,Things Others Do and The Information They Provide,สิ่งที่คนอื่นทำและข้อมูลที่พวกเขาให้,,,,,
privacyPolicy.content27.5,privacyPolicy,"We also collect content and information that other people provide when they use our Services, including information about you, such as when they share a photo of you.  In any case we deal with such data as your Personal Data and treat it accordingly.",นอกจากนี้เรายังรวบรวมเนื้อหาและข้อมูลที่ผู้อื่นให้ เมื่อพวกเขาใช้บริการของเรา รวมถึงข้อมูลเกี่ยวกับคุณ เช่น เมื่อพวกเขาแบ่งปันภาพถ่ายของคุณ ไม่ว่าในกรณีใดเราจัดการกับข้อมูล เช่นข้อมูลส่วนบุคคลของคุณและปฏิบัติตาม,,,,,
privacyPolicy.content27.6,privacyPolicy,Your Network and Connections,เครือข่ายและการเชื่อมต่อของคุณ,,,,,
privacyPolicy.content27.7,privacyPolicy,"We collect the information about the people and groups you are connected to and how you interact with them, such as the people you communicate with the most or the groups you like to share with.",เรารวบรวมข้อมูลเกี่ยวกับผู้คน และกลุ่มที่คุณเชื่อมต่อ และวิธีที่คุณโต้ตอบกับพวกเขา เช่น คนที่คุณสื่อสารด้วยส่วนใหญ่ หรือกลุ่มที่คุณต้องการแชร์ด้วย,,,,,
privacyPolicy.content27.8,privacyPolicy,Information About Payments,ข้อมูลเกี่ยวกับการชำระเงิน,,,,,
privacyPolicy.content27.9,privacyPolicy,"If you use our Services for purchases or financial transactions (like when you buy something on Facebook, make a purchase in a game or make a donation), we collect information about the purchase or transaction. This includes your payment information, such as your credit or debit card number and other card information, and other account and authentication information, as well as billing, shipping and contact details.",หากคุณใช้บริการของเราสำหรับการซื้อหรือการทำธุรกรรมทางการเงิน (เช่นเมื่อคุณซื้อบางอย่างบน Facebook ทำการซื้อในเกมหรือบริจาค) เรารวบรวมข้อมูลเกี่ยวกับการซื้อหรือการทำธุรกรรม ซึ่งรวมถึงข้อมูลการชำระเงินของคุณ เช่น หมายเลขบัตรเครดิตหรือบัตรเดบิตของคุณ และข้อมูลบัตรอื่นๆ และข้อมูลบัญชี และการตรวจสอบสิทธิ์อื่นๆ รวมถึงการเรียกเก็บเงินการขนส่ง และรายละเอียดการติดต่อ,,,,,
privacyPolicy.content27.10,privacyPolicy,Device Information,ข้อมูลอุปกรณ์,,,,,
privacyPolicy.content27.11,privacyPolicy,"We collect information from or about the computers, phones or other devices where you install or access our Services, depending on the permissions you have granted. We may associate the information we collect from your different devices, which helps us provideconsistent Services across your devices.",เรารวบรวมข้อมูลจากหรือเกี่ยวกับคอมพิวเตอร์ โทรศัพท์ หรืออุปกรณ์อื่นๆ ที่คุณติดตั้งหรือเข้าถึงบริการของเราทั้งนี้ขึ้นอยู่กับการอนุญาตที่คุณให้ไว้ เราอาจเชื่อมโยงข้อมูลที่เรารวบรวมจากอุปกรณ์ต่างๆ ของคุณซึ่งช่วยให้เราสามารถให้บริการที่สอดคล้องกับอุปกรณ์ของคุณ,,,,,
privacyPolicy.content27.12,privacyPolicy,Information From Websites and Apps that Use Our Services,ข้อมูลจากเว็บไซต์และแอปพลิเคชั่นที่ใช้บริการของเรา,,,,,
privacyPolicy.content27.13,privacyPolicy,"We collect information when you visit or use third-party websites and apps that use our Services (like when they offer our Like button or Facebook Log in or use our measurement and advertising services). This includes information about the websites and apps you visit, your use of our Services on those apps and websites, as well as the information the developer or publisher provides to you or us.",เรารวบรวมข้อมูลเมื่อคุณเยี่ยมชมหรือใช้เว็บไซต์และแอปพลิเคชั่นของบุคคลที่สามที่ใช้บริการของเรา (เช่นเมื่อพวกเขามีปุ่ม Like หรือ Facebook Log in หรือใช้บริการการวัดและการโฆษณาของเรา) ซึ่งรวมถึงข้อมูลเกี่ยวกับเว็บไซต์และแอปพลิเคชั่นที่คุณเยี่ยมชมการใช้บริการของเราในแอปพลิเคชั่นและเว็บไซต์เหล่านั้นรวมถึงข้อมูลที่นักพัฒนาหรือผู้เผยแพร่มอบให้คุณหรือเรา,,,,,
privacyPolicy.content27.14,privacyPolicy,Information From Third Party Partners,ข้อมูลจากพันธมิตรบุคคลที่สาม,,,,,
privacyPolicy.content27.15,privacyPolicy,"We receive information about you and your activities from third party partners, such as information from a partner when we jointly offer services or from an advertiser about your experiences and interactions with them. If we combine or associate information from other sources with Personal Data that we collect through the Service, we will treat the combined information as Personal Data in accordance with this Policy.",เราได้รับข้อมูลเกี่ยวกับคุณและกิจกรรมของคุณจากพันธมิตรบุคคลที่สาม เช่น ข้อมูลจากพันธมิตรเมื่อเราร่วมให้บริการ หรือจากผู้โฆษณาเกี่ยวกับประสบการณ์ และการมีปฏิสัมพันธ์กับพวกเขา หากเรารวมหรือเชื่อมโยงข้อมูลจากแหล่งอื่นๆ กับข้อมูลส่วนบุคคลที่เรารวบรวมผ่านบริการ เราจะถือว่าข้อมูลรวมเป็นข้อมูลส่วนบุคคลตามนโยบายนี้,,,,,
privacyPolicy.content27.16,privacyPolicy,"\""Automatically Collected\"" Information","ข้อมูล \""รวบรวมโดยอัตโนมัติ\""",,,,,
privacyPolicy.content27.17,privacyPolicy,"When you use the Service, we may automatically record certain information from your device by using various types of technology,including cookies. This \""automatically collected\"" information may include IP address or other device address or ID, web browser and/or device type, the web pages or sites visited just before or just after using the Service, the pages or other content you view or interacts with on the Service, and the dates and times of the visit, access, or use of the Service.","เมื่อคุณใช้บริการเราอาจบันทึกข้อมูลบางอย่างจากอุปกรณ์ของคุณโดยอัตโนมัติ โดยใช้เทคโนโลยีประเภทต่างๆ รวมถึงคุกกี้ ข้อมูล \""ที่รวบรวมโดยอัตโนมัติ\"" นี้อาจรวมถึงที่อยู่ IP หรือที่อยู่อุปกรณ์หรือ ID อื่นๆ , เว็บเบราว์เซอร์และ / หรือประเภทอุปกรณ์, หน้าเว็บหรือเว็บไซต์ที่เข้าชมก่อนหรือหลังการใช้บริการ, หน้าเว็บหรือเนื้อหาอื่นๆ โต้ตอบกับบริการ และวันที่และเวลา ของการเยี่ยมชมการเข้าถึงหรือการใช้บริการ",,,,,
privacyPolicy.title.content28,privacyPolicy,2. How We Use the Information We Collect,2. วิธีที่เราใช้ข้อมูลที่เราเก็บรวบรวม,,,,,
privacyPolicy.content28.2,privacyPolicy,"We use the information that we collect in a number of ways for the purposes of providing the Service and operating our business, including the following:",เราใช้ข้อมูลที่เรารวบรวมในหลายวิธีเพื่อวัตถุประสงค์ในการให้บริการและการดำเนินธุรกิจของเรารวมถึงต่อไปนี้:,,,,,
privacyPolicy.content28.3,privacyPolicy,Operations,การดำเนินงาน,,,,,
privacyPolicy.content28.4,privacyPolicy,"We use the information to operate, maintain, enhance and provide all features of the Service, to provide the services and information that you request, to provide support to users of the Service. We process your Personal Data solely in accordance with the directions provided by you. (legal base in cases of applicability: art. 6(1)(f) of the EU General Data Protection Regulation (GDPR).)",เราใช้ข้อมูลเพื่อดำเนินการบำรุงรักษา ปรับปรุง และมอบคุณสมบัติทั้งหมดของบริการ เพื่อให้บริการและข้อมูลที่คุณร้องขอ เพื่อให้การสนับสนุนแก่ผู้ใช้บริการ เราประมวลผลข้อมูลส่วนบุคคลของคุณ แต่เพียงผู้เดียวตามคำแนะนำของคุณ (ฐานกฎหมายในกรณีที่มีการบังคับใช้: ศิลปะ. 6 (1) (f) ของระเบียบป้องกันข้อมูลทั่วไปของสหภาพยุโรป (GDPR),,,,,
privacyPolicy.content28.5,privacyPolicy,Improvements,ปรับปรุง,,,,,
privacyPolicy.content28.6,privacyPolicy,"We use the information to understand and analyze your usage trends and preferences, to improve the Service, to develop new products, services, feature, and functionality. If this purpose require IYC to process Personal Data, then the data will only be used in anonymized or aggregated form (legal base in cases of applicability: art. 6(1)(f) of the EU General Data Protection Regulation (GDPR)).",เราใช้ข้อมูลเพื่อทำความเข้าใจ และวิเคราะห์แนวโน้มการใช้งาน และการตั้งค่าของคุณเพื่อปรับปรุงการบริการเพื่อพัฒนาผลิตภัณฑ์บริการ คุณลักษณะและการทำงานใหม่ๆ หากวัตถุประสงค์นี้ต้องการ IYC ในการประมวลผลข้อมูลส่วนบุคคลข้อมูลนั้นจะถูกใช้ในรูปแบบที่ไม่เปิดเผยชื่อหรือรวมไว้เท่านั้น (ฐานทางกฎหมายในกรณีที่มีการบังคับใช้: ศิลปะ 6 (1) (f) ของระเบียบคุ้มครองข้อมูลทั่วไปของสหภาพยุโรป (GDPR)) .,,,,,
privacyPolicy.content28.7,privacyPolicy,Communications,การสื่อสาร,,,,,
